### ISSUE TITLE
The driver hangs in cn.recvMessage(r) every 15 minutes or so (Postgres 9.4)

### ISSUE THREAD

**Issue by medvednikov** [lib/pq#319]
Hello,

I've been debugging this weird problem where my Go web app would sometimes freeze and load for ever. But an instant page refresh fixes this problem. I traced it down to lib/pq. It happens after about 15 minutes of no requests to the database. Perhaps I should somehow keep the connection open, but  I would expect the driver to give me an error about that instead of getting stuck.

Here's where it gets stuck:

```
func (cn *conn) Query(query string, args []driver.Value) (_ driver.Rows, err error) 

func (cn *conn) prepareTo(q, stmtName string) (_ *stmt, err error)
  ...
  for {
    t, r := cn.recv1()
```

Here's how I initialize the db:

```
DB, err = sql.Open("postgres", fmt.Sprintf(
		"host=%s user=%s password=%s dbname=%s sslmode=disable",
		DbHost, DbUser, DbPassword, DbName))
```

Thanks!

**Comment by medvednikov** [comment]
I went a bit deeper and, it actually gets stuck in ```cn.recvMessage(r)``` call in ```recv1Buf(r *readBuf)```

**Comment by johto** [comment]
> I've been debugging this weird problem where my Go web app would sometimes freeze and load for ever.

Literally forever?  Or just for a very long time?

If something times out the TCP connection after inactivity, it could easily take more than 15 minutes before the OS decides that the connection is dead and tells the Go program about it.  I'd try and monitor the traffic with tcpdump and/or Wireshark when it happens.

**Comment by medvednikov** [comment]
I think the longest I waited before refreshing the page was about 30 minutes.

Here's what I get with strace after requesting the page and getting a freeze:

```
sudo strace -p 15318 -f -e trace=network -s 10000
Process 15318 attached with 5 threads - interrupt to quit

[pid 15318] accept4(5, {sa_family=AF_INET6, sin6_port=htons(54138), inet_pton(AF_INET6, "::ffff:82.156.77.219", &sin6_addr), sin6_flowinfo=0, sin6_scope_id=0}, [28], SOCK_CLOEXEC|SOCK_NONBLOCK) = 3
[pid 15318] getsockname(3, {sa_family=AF_INET6, sin6_port=htons(80), inet_pton(AF_INET6, "::ffff:10.240.248.156", &sin6_addr), sin6_flowinfo=0, sin6_scope_id=0}, [28]) = 0
[pid 15318] setsockopt(3, SOL_TCP, TCP_NODELAY, [1], 4) = 0
[pid 15318] setsockopt(3, SOL_SOCKET, SO_KEEPALIVE, [1], 4) = 0
[pid 15318] setsockopt(3, SOL_TCP, TCP_KEEPINTVL, [180], 4) = 0
[pid 15318] setsockopt(3, SOL_TCP, TCP_KEEPIDLE, [180], 4) = 0
[pid 15318] accept4(5, 0xc2080b5a00, [112], SOCK_CLOEXEC|SOCK_NONBLOCK) = -1 EAGAIN (Resource temporarily unavailable)
```
I'm running the server on Debian/Google Compute.

**Comment by medvednikov** [comment]
Strangely enough I get the same response when the sites loads.

The postgres server is running on a separate instance with a different IP.

**Comment by medvednikov** [comment]
This is what I get with tcpdump:

```
14:10:41.126818 IP 10.240.248.156.57501 > 130.211.73.54.5432: Flags [P.], seq 243:284, ack 7666, win 1008, options [nop,nop,TS val 108780963 ecr 1389818754], length 41
14:10:41.126860 IP 10.240.248.156.57501 > 130.211.73.54.5432: Flags [P.], seq 284:291, ack 7666, win 1008, options [nop,nop,TS val 108780963 ecr 1389818754], length 7
14:10:41.126870 IP 10.240.248.156.57501 > 130.211.73.54.5432: Flags [P.], seq 291:296, ack 7666, win 1008, options [nop,nop,TS val 108780963 ecr 1389818754], length 5
14:10:41.333037 IP 10.240.248.156.57501 > 130.211.73.54.5432: Flags [P.], seq 243:284, ack 7666, win 1008, options [nop,nop,TS val 108781015 ecr 1389818754], length 41
14:10:41.749048 IP 10.240.248.156.57501 > 130.211.73.54.5432: Flags [P.], seq 243:284, ack 7666, win 1008, options [nop,nop,TS val 108781119 ecr 1389818754], length 41
14:10:42.581040 IP 10.240.248.156.57501 > 130.211.73.54.5432: Flags [P.], seq 243:284, ack 7666, win 1008, options [nop,nop,TS val 108781327 ecr 1389818754], length 41
14:10:44.249051 IP 10.240.248.156.57501 > 130.211.73.54.5432: Flags [P.], seq 243:284, ack 7666, win 1008, options [nop,nop,TS val 108781744 ecr 1389818754], length 41
14:10:47.585071 IP 10.240.248.156.57501 > 130.211.73.54.5432: Flags [P.], seq 243:284, ack 7666, win 1008, options [nop,nop,TS val 108782578 ecr 1389818754], length 41
14:10:54.265076 IP 10.240.248.156.57501 > 130.211.73.54.5432: Flags [P.], seq 243:284, ack 7666, win 1008, options [nop,nop,TS val 108784248 ecr 1389818754], length 41
14:11:07.609029 IP 10.240.248.156.57501 > 130.211.73.54.5432: Flags [P.], seq 243:284, ack 7666, win 1008, options [nop,nop,TS val 108787584 ecr 1389818754], length 41
14:11:34.297054 IP 10.240.248.156.57501 > 130.211.73.54.5432: Flags [P.], seq 243:284, ack 7666, win 1008, options [nop,nop,TS val 108794256 ecr 1389818754], length 41
```
130.211.73.54 is the database server.

**Comment by johto** [comment]
> This is what I get with tcpdump:

Looks like it's trying to retransmit the 'seq 243:284' packet since it doesn't get an ACK from the database, which suggests that the TCP connection was killed by something between the Go app and Postgres.  Perhaps you want to enable TCP keepalives from the postgres side to fix this issue.

**Comment by medvednikov** [comment]
Thanks for your help. I solved it with a simple timeout function in Go. The underlying problem is obviously still there, could be Google Compute configuration.

I still think that broken connections need to be handled though.

**Comment by johto** [comment]
> I still think that broken connections need to be handled though.

You mean in pq?  Because they already are.  But if the operating system doesn't tell Go that the connection is dead, there's not much you can do.  There's no way to distinguish between "the query was sent, but the server is taking a long time to produce the results" and "the query was sent but the server never received it because the TCP connection is broken" from the application.

**Comment by kingcr7** [comment]
> Thanks for your help. I solved it with a simple timeout function in Go. The underlying problem is obviously still there, could be Google Compute configuration.
> 
> I still think that broken connections need to be handled though.

How did you solve it？i have a probelm same with you
